{
  "protocol_version": "trilha.execution/v1",
  "id": "run-000007",
  "project": "trilha-cloud-demo",
  "task_id": "TASK-002",
  "status": "needs_input",
  "phase": "awaiting_input",
  "progress": 100,
  "attempt": 1,
  "max_attempts": 3,
  "worker": "runner-a",
  "created": "2026-10-25T12:00:00Z",
  "started": "2026-10-25T12:00:01Z",
  "finished": "2026-10-25T12:03:20Z",
  "kind": "implement",
  "agent_state": "asked",
  "attention": ["The agent asked a question"],
  "context": {
    "overview": "Adds CSV export to the report screen.",
    "notes": [
      { "content": "The report query already paginates; reuse it.", "source": "operator", "by": "operator@example.com", "at": "2026-10-24T18:00:00Z" }
    ]
  },
  "events": [
    { "sequence": 1, "at": "2026-10-25T12:00:01Z", "phase": "consulting_ai", "message": "Agent started", "attempt": 1 },
    { "sequence": 2, "at": "2026-10-25T12:03:20Z", "phase": "awaiting_input", "message": "The agent asked a question", "attempt": 1 }
  ],
  "attempts": [
    {
      "number": 1,
      "status": "passed",
      "model": "claude-opus-5-5",
      "provider": "anthropic",
      "tokens_in": 1800,
      "tokens_out": 400,
      "cost": 0.031,
      "currency": "USD",
      "started": "2026-10-25T12:00:01Z",
      "finished": "2026-10-25T12:03:20Z"
    }
  ],
  "result": {
    "passed": false,
    "status": "needs_input",
    "branch": "trilha/task-002",
    "commit": "def456",
    "question": { "text": "Should the CSV include archived rows, or only active ones?", "asked_at": "2026-10-25T12:03:19Z" },
    "session": { "driver": "claude-code", "session_id": "3f2a9c1e-0000-4000-8000-000000000001" },
    "overview": "CSV export drafted; waiting to know whether archived rows belong in it.",
    "notes": [
      { "content": "Archived rows are filtered in ReportQuery.Active, not in SQL.", "source": "ai", "at": "2026-10-25T12:02:00Z" }
    ],
    "diff_stats": { "files": 3, "insertions": 42, "deletions": 5 },
    "duration_ms": 199000
  }
}
